{
  "$schema": "https://pptx.dev/schema/opf-theme/v1",
  "id": "bold",
  "name": "Bold",
  "background": "light1",
  "colorScheme": "burnt-orange",
  "description": "A vibrant, high-energy theme with bold colors and a dynamic, attention-grabbing style. Great for presentations that need to stand out.",
  "fontScheme": "impact",
  "dimensions": "widescreen"
}
